{"version":1,"method":"Merged the three independent full-question semantic reviews into a normalized preparation taxonomy. Topics are ranked study units, while broad domains are navigation only. Duplicate and near-duplicate proposals were reconciled by tested knowledge rather than wording or keywords; examples are limited to row indices explicitly cited in the reports.","topics":[{"id":"word-meanings-synonyms-register","broad_id":"language-expression","broad_sl":"Jezik in izražanje","broad_en":"Language and expression","label_sl":"Pomeni besed, sopomenke in jezikovne zvrsti","label_en":"Word meanings, synonyms and register","description_sl":"Pomen knjižnih, arhaičnih, narečnih in pogovornih slovenskih besed ter izbira sopomenk.","description_en":"Meanings of standard, archaic, dialectal and colloquial Slovenian words and selection of synonyms.","inclusion":"Direct lexical definitions, synonyms and register distinctions.","exclusion":"Idioms, proverbs, specialist terminology and foreign-expression translation.","study_focus_sl":"Uči se pomenov, sopomenk in slogovne zaznamovanosti besed.","study_focus_en":"Study meanings, synonyms and register labels.","example_indices":[16,3760,4400,6389]},{"id":"loanwords-foreign-phrases-translations","broad_id":"language-expression","broad_sl":"Jezik in izražanje","broad_en":"Language and expression","label_sl":"Tujke, tujejezični izrazi in dobesedni prevodi","label_en":"Loanwords, foreign phrases and literal translations","description_sl":"Izvor ali pomen prevzetih besed ter prevodi latinskih in drugih ustaljenih tujejezičnih izrazov.","description_en":"Origins or meanings of loanwords and translations of established Latin and other foreign phrases.","inclusion":"Loanword origins, foreign maxims, conventional utterances and literal translations.","exclusion":"Acronym expansion, historical country names and ordinary Slovenian vocabulary.","study_focus_sl":"Preglej pogoste tujke, latinske izreke in njihove dobesedne pomene.","study_focus_en":"Review common loanwords, Latin expressions and literal meanings.","example_indices":[1520,5024,6000,7461]},{"id":"abbreviations-alphabets-notation","broad_id":"language-expression","broad_sl":"Jezik in izražanje","broad_en":"Language and expression","label_sl":"Kratice, abecede in dogovorjeni zapisi","label_en":"Abbreviations, alphabets and conventional notation","description_sl":"Razvezovanje kratic ter prepoznavanje črk, rimskih številk in splošnih zapisovalnih simbolov.","description_en":"Expansion of abbreviations and recognition of letters, Roman numerals and general notation symbols.","inclusion":"The written form or expansion itself is the tested knowledge.","exclusion":"Institutional purpose, football technology, file formats and chemical properties when those are primary.","study_focus_sl":"Uči se razvezav kratic ter osnovnih črkovnih in številskih zapisov.","study_focus_en":"Study acronym expansions and basic alphabetic and numeric notation.","example_indices":[32,250,6768,7552]},{"id":"slovenian-grammar-spelling-word-formation","broad_id":"language-expression","broad_sl":"Jezik in izražanje","broad_en":"Language and expression","label_sl":"Slovenska slovnica, pravopis in besedotvorje","label_en":"Slovenian grammar, spelling and word formation","description_sl":"Formalna zgradba slovenščine: abeceda, skloni, besedne vrste, pravopis in tvorjenje oblik.","description_en":"Formal structure of Slovenian: alphabet, cases, word classes, spelling and formation of word forms.","inclusion":"Questions requiring a grammatical or orthographic rule.","exclusion":"Definitions of already formed words and translation of foreign phrases.","study_focus_sl":"Ponovi slovnične kategorije, pravopisna pravila in tvorbo besed.","study_focus_en":"Review grammatical categories, spelling rules and word formation.","example_indices":[336,2096,6064,8010]},{"id":"slovenian-proverbs","broad_id":"language-expression","broad_sl":"Jezik in izražanje","broad_en":"Language and expression","label_sl":"Slovenski pregovori","label_en":"Slovenian proverbs","description_sl":"Dopolnjevanje in razlaga ustaljenih pregovornih povedi s splošnim naukom.","description_en":"Completion and interpretation of established proverbial sentences expressing a general lesson.","inclusion":"Complete proverbial propositions and their conventional continuations or meanings.","exclusion":"Short figurative phrases, quotations from identified works and song lyrics.","study_focus_sl":"Vadi celotne oblike pregovorov in njihov nauk.","study_focus_en":"Practise complete proverb forms and their lessons.","example_indices":[1040,1552,2064,5424]},{"id":"slovenian-idioms-colloquialisms","broad_id":"language-expression","broad_sl":"Jezik in izražanje","broad_en":"Language and expression","label_sl":"Slovenski frazemi in pogovorni izrazi","label_en":"Slovenian idioms and colloquial expressions","description_sl":"Stalne figurativne zveze, evfemizmi in pogovorni preneseni pomeni.","description_en":"Fixed figurative phrases, euphemisms and colloquial transferred meanings.","inclusion":"Meaning or completion of a non-propositional fixed expression.","exclusion":"Full proverbs, literal vocabulary and work-specific quotations.","study_focus_sl":"Poveži pogoste frazeme z njihovimi prenesenimi pomeni.","study_focus_en":"Match common idioms to their figurative meanings.","example_indices":[384,1392,2912,3840]},{"id":"wordplay-homonyms-verbal-riddles","broad_id":"language-expression","broad_sl":"Jezik in izražanje","broad_en":"Language and expression","label_sl":"Besedne igre, enakozvočnice in jezikovne uganke","label_en":"Wordplay, homonyms and verbal riddles","description_sl":"Vprašanja, pri katerih rešitev temelji na dvojnem pomenu, enakem poimenovanju ali jezikovnem triku.","description_en":"Questions whose solution depends on double meaning, shared naming or a verbal trick.","inclusion":"The ambiguity of language is essential to solving the question.","exclusion":"Questions answerable primarily through factual subject knowledge.","study_focus_sl":"Vadi prepoznavanje večpomenskosti in značilnih besednih ugank.","study_focus_en":"Practise spotting polysemy and common verbal-riddle patterns.","example_indices":[245,2373,3333,4101]},{"id":"calendar-time-date-reckoning","broad_id":"language-expression","broad_sl":"Jezik in izražanje","broad_en":"Language and expression","label_sl":"Koledar, čas in računanje datumov","label_en":"Calendar, time and date reckoning","description_sl":"Koledarske enote, prestopna leta, tradicionalna imena mesecev in pretvarjanje časovnih obdobij.","description_en":"Calendar units, leap years, traditional month names and conversion of time periods.","inclusion":"General calendar conventions and arithmetic with days, weeks, months, hours or years.","exclusion":"Dates of historical events, religious feasts and commemorative holidays.","study_focus_sl":"Ponovi koledarske enote, prestopna pravila in časovne pretvorbe.","study_focus_en":"Review calendar units, leap-year rules and time conversions.","example_indices":[304,1264,3456,9040]},{"id":"france-preseren-life-works-legacy","broad_id":"literature","broad_sl":"Književnost","broad_en":"Literature","label_sl":"France Prešeren: življenje, dela in dediščina","label_en":"France Prešeren: life, works and legacy","description_sl":"Prešernova biografija, pesmi, Julija Primic, satira in kulturna dediščina.","description_en":"Prešeren's biography, poems, Julija Primic, satire and cultural legacy.","inclusion":"Questions specifically centred on Prešeren or his works.","exclusion":"General poetic terminology and other Slovenian authors.","study_focus_sl":"Poveži pesmi, biografske mejnike, osebe in spomeniško dediščino.","study_focus_en":"Connect poems, biographical milestones, people and commemorative legacy.","example_indices":[1429,2309,3514,5962]},{"id":"ivan-cankar-works-characters-reception","broad_id":"literature","broad_sl":"Književnost","broad_en":"Literature","label_sl":"Ivan Cankar: dela, liki in recepcija","label_en":"Ivan Cankar: works, characters and reception","description_sl":"Cankarjeva dela, začetki besedil, liki, motivi, kraji in cenzurna zgodovina.","description_en":"Cankar's works, openings, characters, motifs, places and censorship history.","inclusion":"Questions whose preparation unit is Cankar's biography or corpus.","exclusion":"Other Slovenian prose and general literary concepts.","study_focus_sl":"Preglej naslove, like, značilne motive in biografski kontekst.","study_focus_en":"Review titles, characters, recurring motifs and biographical context.","example_indices":[1386,1861,2218,8981]},{"id":"trubar-reformation-early-slovenian-print","broad_id":"literature","broad_sl":"Književnost","broad_en":"Literature","label_sl":"Primož Trubar, reformacija in zgodnji slovenski tisk","label_en":"Primož Trubar, the Reformation and early Slovenian print","description_sl":"Trubarjeva dela, psevdonimi, prevodi in slovenska protestantska knjižna zgodovina.","description_en":"Trubar's works, pseudonyms, translations and Slovenian Protestant book history.","inclusion":"Trubar and Reformation-era Slovenian writing or printing.","exclusion":"Later Slovenian literature and general medieval church history.","study_focus_sl":"Uči se prvih slovenskih knjig, prevodov in reformacijskega okolja.","study_focus_en":"Study the earliest Slovenian books, translations and Reformation context.","example_indices":[2090,2746,5370,7706]},{"id":"slovenian-authors-works-poetry","broad_id":"literature","broad_sl":"Književnost","broad_en":"Literature","label_sl":"Slovenski avtorji, dela in poezija","label_en":"Slovenian authors, works and poetry","description_sl":"Povezovanje slovenskih pesnikov in pisateljev z naslovi, zbirkami, verzi in biografijo.","description_en":"Associating Slovenian poets and writers with titles, collections, lines and biography.","inclusion":"Author-work attribution and bibliographic facts outside dedicated author topics.","exclusion":